{
  "artifact_schema_version": "1.0",
  "created_at": "2026-08-23T13:55:00.392338Z",
  "dataset": {
    "dataset_id": "DIG-RNP-SYN-v1",
    "generator_version": "1.0.0",
    "manifest_sha256": "1c285947c38bd0623b56cfb156dcc2eb3157505e5b8fc8bca45c089158ab3681",
    "split": "holdout",
    "synthetic": true
  },
  "metrics": {
    "baseline": {
      "by_gate_status": {
        "BLOCK": {
          "label": "BLOCK",
          "predicted": 10,
          "scores": {
            "f1": 0.6666666666666666,
            "false_negative": 10,
            "false_positive": 0,
            "precision": {
              "denominator": 10,
              "numerator": 10,
              "value": 1.0
            },
            "recall": {
              "denominator": 20,
              "numerator": 10,
              "value": 0.5
            },
            "true_positive": 10
          },
          "support": 20
        },
        "PASS": {
          "label": "PASS",
          "predicted": 30,
          "scores": {
            "f1": 0.8,
            "false_negative": 0,
            "false_positive": 10,
            "precision": {
              "denominator": 30,
              "numerator": 20,
              "value": 0.6666666666666666
            },
            "recall": {
              "denominator": 20,
              "numerator": 20,
              "value": 1.0
            },
            "true_positive": 20
          },
          "support": 20
        },
        "REVIEW": {
          "label": "REVIEW",
          "predicted": 20,
          "scores": {
            "f1": 1.0,
            "false_negative": 0,
            "false_positive": 0,
            "precision": {
              "denominator": 20,
              "numerator": 20,
              "value": 1.0
            },
            "recall": {
              "denominator": 20,
              "numerator": 20,
              "value": 1.0
            },
            "true_positive": 20
          },
          "support": 20
        }
      },
      "claims": {
        "by_type": {
          "refund_amount": {
            "label": "refund_amount",
            "predicted": 30,
            "scores": {
              "f1": 0.5,
              "false_negative": 0,
              "false_positive": 20,
              "precision": {
                "denominator": 30,
                "numerator": 10,
                "value": 0.3333333333333333
              },
              "recall": {
                "denominator": 10,
                "numerator": 10,
                "value": 1.0
              },
              "true_positive": 10
            },
            "support": 10
          },
          "refund_approved": {
            "label": "refund_approved",
            "predicted": 0,
            "scores": {
              "f1": 0.0,
              "false_negative": 10,
              "false_positive": 0,
              "precision": {
                "denominator": 0,
                "numerator": 0,
                "value": null
              },
              "recall": {
                "denominator": 10,
                "numerator": 0,
                "value": 0.0
              },
              "true_positive": 0
            },
            "support": 10
          },
          "refund_claimed_processed": {
            "label": "refund_claimed_processed",
            "predicted": 10,
            "scores": {
              "f1": 0.5,
              "false_negative": 20,
              "false_positive": 0,
              "precision": {
                "denominator": 10,
                "numerator": 10,
                "value": 1.0
              },
              "recall": {
                "denominator": 30,
                "numerator": 10,
                "value": 0.3333333333333333
              },
              "true_positive": 10
            },
            "support": 30
          }
        },
        "exact_grounding_rate": {
          "denominator": 40,
          "numerator": 40,
          "value": 1.0
        },
        "macro_f1": 0.3333333333333333,
        "micro": {
          "f1": 0.4444444444444444,
          "false_negative": 30,
          "false_positive": 20,
          "precision": {
            "denominator": 40,
            "numerator": 20,
            "value": 0.5
          },
          "recall": {
            "denominator": 50,
            "numerator": 20,
            "value": 0.4
          },
          "true_positive": 20
        },
        "normalized_value_accuracy": {
          "denominator": 20,
          "numerator": 20,
          "value": 1.0
        }
      },
      "confusion_matrix": {
        "BLOCK": {
          "BLOCK": 10,
          "PASS": 10,
          "REVIEW": 0
        },
        "PASS": {
          "BLOCK": 0,
          "PASS": 20,
          "REVIEW": 0
        },
        "REVIEW": {
          "BLOCK": 0,
          "PASS": 0,
          "REVIEW": 20
        }
      },
      "material_conflict": {
        "f1": 0.6666666666666666,
        "false_negative": 10,
        "false_positive": 0,
        "precision": {
          "denominator": 10,
          "numerator": 10,
          "value": 1.0
        },
        "recall": {
          "denominator": 20,
          "numerator": 10,
          "value": 0.5
        },
        "true_positive": 10
      },
      "operational": {
        "auto_decision_coverage": {
          "denominator": 60,
          "numerator": 40,
          "value": 0.6666666666666666
        },
        "false_block_nonblock_cases": 0,
        "false_pass_block_cases": 10,
        "review_rate": {
          "denominator": 60,
          "numerator": 20,
          "value": 0.3333333333333333
        },
        "total_cases": 60
      },
      "slices": {
        "claimed_processed_match": {
          "correct": 10,
          "expected": {
            "BLOCK": 0,
            "PASS": 10,
            "REVIEW": 0
          },
          "predicted": {
            "BLOCK": 0,
            "PASS": 10,
            "REVIEW": 0
          },
          "total": 10
        },
        "claimed_processed_no_ledger": {
          "correct": 10,
          "expected": {
            "BLOCK": 10,
            "PASS": 0,
            "REVIEW": 0
          },
          "predicted": {
            "BLOCK": 10,
            "PASS": 0,
            "REVIEW": 0
          },
          "total": 10
        },
        "negation_hard_negative": {
          "correct": 10,
          "expected": {
            "BLOCK": 0,
            "PASS": 10,
            "REVIEW": 0
          },
          "predicted": {
            "BLOCK": 0,
            "PASS": 10,
            "REVIEW": 0
          },
          "total": 10
        },
        "partial_full_amount": {
          "correct": 0,
          "expected": {
            "BLOCK": 10,
            "PASS": 0,
            "REVIEW": 0
          },
          "predicted": {
            "BLOCK": 0,
            "PASS": 10,
            "REVIEW": 0
          },
          "total": 10
        },
        "provider_grounding_failure": {
          "correct": 10,
          "expected": {
            "BLOCK": 0,
            "PASS": 0,
            "REVIEW": 10
          },
          "predicted": {
            "BLOCK": 0,
            "PASS": 0,
            "REVIEW": 10
          },
          "total": 10
        },
        "unsupported_ood": {
          "correct": 10,
          "expected": {
            "BLOCK": 0,
            "PASS": 0,
            "REVIEW": 10
          },
          "predicted": {
            "BLOCK": 0,
            "PASS": 0,
            "REVIEW": 10
          },
          "total": 10
        }
      },
      "three_class_macro_f1": 0.8222222222222223
    },
    "baseline_delta": {
      "proposed_minus_baseline": {
        "auto_decision_coverage": 0.0,
        "claim_micro_f1": 0.0,
        "exact_grounding_rate": 0.0,
        "false_block_nonblock_cases": 0,
        "false_pass_block_cases": 0,
        "material_f1": 0.0,
        "material_precision": 0.0,
        "material_recall": 0.0,
        "review_rate": 0.0
      }
    },
    "by_gate_status": {
      "BLOCK": {
        "label": "BLOCK",
        "predicted": 10,
        "scores": {
          "f1": 0.6666666666666666,
          "false_negative": 10,
          "false_positive": 0,
          "precision": {
            "denominator": 10,
            "numerator": 10,
            "value": 1.0
          },
          "recall": {
            "denominator": 20,
            "numerator": 10,
            "value": 0.5
          },
          "true_positive": 10
        },
        "support": 20
      },
      "PASS": {
        "label": "PASS",
        "predicted": 30,
        "scores": {
          "f1": 0.8,
          "false_negative": 0,
          "false_positive": 10,
          "precision": {
            "denominator": 30,
            "numerator": 20,
            "value": 0.6666666666666666
          },
          "recall": {
            "denominator": 20,
            "numerator": 20,
            "value": 1.0
          },
          "true_positive": 20
        },
        "support": 20
      },
      "REVIEW": {
        "label": "REVIEW",
        "predicted": 20,
        "scores": {
          "f1": 1.0,
          "false_negative": 0,
          "false_positive": 0,
          "precision": {
            "denominator": 20,
            "numerator": 20,
            "value": 1.0
          },
          "recall": {
            "denominator": 20,
            "numerator": 20,
            "value": 1.0
          },
          "true_positive": 20
        },
        "support": 20
      }
    },
    "claims": {
      "by_type": {
        "refund_amount": {
          "label": "refund_amount",
          "predicted": 30,
          "scores": {
            "f1": 0.5,
            "false_negative": 0,
            "false_positive": 20,
            "precision": {
              "denominator": 30,
              "numerator": 10,
              "value": 0.3333333333333333
            },
            "recall": {
              "denominator": 10,